{
	"title": "Mystery Symptoms",
	"description": "House and his team race to diagnose a patient with bizarre symptoms that don't seem to match any known illness.",
	"duration": 172,
	"all_scenes": ["Hospital_Room", "Hallway", "Meeting", "MRI", "Office"],
	"all_characters": ["House", "Wilson", "Chase", "Cameron", "Patient"],

	"timeline": [
		{
			"timestamp": 0,
			"actions": [
				{
					"action_type": "scene",
					"scene": "Hospital_Room",
					"transition_effect": "fade_in",
					"duration": 2,
					"initialState": {
						"characters": [
							{
								"name": "Patient",
								"visible": true,
								"position": {
									"startX": 1010.3,
									"startY": 515.8,
									"scale": 0.25,
									"rotation": 50
								}
							}
						]
					}
				}
			]
		},
		{
			"timestamp": 5,
			"actions": [
				{
					"character": "Patient",
					"action_type": "talk",
					"dialogue": "Doctor, please help! I have terrible head and stomach pains!",
					"duration": 5
				}
			]
		},
		{
			"timestamp": 15,
			"actions": [
				{
					"character": "House",
					"action_type": "appear",
					"duration": 2
				},
				{
					"character": "House",
					"action_type": "move",
					"duration": 5,
					"position": {
						"startX": 722.4,
						"startY": 750.6,
						"endX": 155.7,
						"endY": 495.9,
						"scale": 0.4
					}
				}
			]
		},
		{
			"timestamp": 25,
			"actions": [
				{
					"character": "House",
					"action_type": "talk",
					"dialogue": "Let's run some tests and figure this out.",
					"duration": 4
				}
			]
		},
		{
			"timestamp": 35,
			"actions": [
				{
					"action_type": "scene",
					"scene": "MRI",
					"transition_effect": "fade_out",
					"duration": 2
				}
			]
		},
		{
			"timestamp": 40,
			"actions": [
				{
					"action_type": "scene",
					"scene": "MRI",
					"transition_effect": "fade_in",
					"duration": 2,
					"initialState": {
						"characters": [
							{
								"name": "Patient",
								"visible": true,
								"position": {
									"startX": 400.7,
									"startY": 400.8,
									"scale": 0.45,
									"rotation": 290
								}
							},
							{
								"name": "Cameron",
								"visible": true,
								"position": {
									"startX": 102.8,
									"startY": 478.0,
									"scale": 0.55
								}
							}
						]
					}
				}
			]
		},
		{
			"timestamp": 45,
			"actions": [
				{
					"character": "Cameron",
					"action_type": "talk",
					"dialogue": "Try to stay very still for the scan.",
					"duration": 3
				}
			]
		},
		{
			"timestamp": 55,
			"actions": [
				{
					"character": "Cameron",
					"action_type": "talk",
					"dialogue": "There's swelling in the temporal lobe. Let's do a lumbar puncture.",
					"duration": 5
				}
			]
		},
		{
			"timestamp": 65,
			"actions": [
				{
					"action_type": "scene",
					"scene": "Meeting",
					"transition_effect": "fade_out",
					"duration": 2
				}
			]
		},
		{
			"timestamp": 70,
			"actions": [
				{
					"action_type": "scene",
					"scene": "Meeting",
					"transition_effect": "fade_in",
					"duration": 2,
					"initialState": {
						"characters": [
							{
								"name": "House",
								"visible": true,
								"position": {
									"startX": 809.9,
									"startY": 561.3,
									"scale": 0.6
								}
							},
							{
								"name": "Chase",
								"visible": true,
								"position": {
									"startX": 326.5,
									"startY": 344.7,
									"scale": 0.3
								}
							}
						]
					}
				}
			]
		},
		{
			"timestamp": 75,
			"actions": [
				{
					"character": "Chase",
					"action_type": "talk",
					"dialogue": "The lumbar puncture was clean. No infections.",
					"duration": 4
				}
			]
		},
		{
			"timestamp": 85,
			"actions": [
				{
					"character": "House",
					"action_type": "talk",
					"dialogue": "Then we need to look for neurological causes. Get an angiogram.",
					"duration": 5
				}
			]
		},
		{
			"timestamp": 95,
			"actions": [
				{
					"action_type": "scene",
					"scene": "Hallway",
					"transition_effect": "fade_out",
					"duration": 2
				}
			]
		},
		{
			"timestamp": 100,
			"actions": [
				{
					"action_type": "scene",
					"scene": "Hallway",
					"transition_effect": "fade_in",
					"duration": 2,
					"initialState": {
						"characters": [
							{
								"name": "House",
								"visible": true,
								"position": {
									"startX": 531.3,
									"startY": 709.3,
									"scale": 0.6
								}
							},
							{
								"name": "Wilson",
								"visible": true,
								"position": {
									"startX": 310.0,
									"startY": 554.2,
									"scale": 0.4
								}
							}
						]
					}
				}
			]
		},
		{
			"timestamp": 105,
			"actions": [
				{
					"character": "Wilson",
					"action_type": "talk",
					"dialogue": "I heard you have a tough new case?",
					"duration": 3
				}
			]
		},
		{
			"timestamp": 110,
			"actions": [
				{
					"character": "House",
					"action_type": "talk",
					"dialogue": "The symptoms don't match anything obvious. But I'll figure it out.",
					"duration": 5
				}
			]
		},
		{
			"timestamp": 120,
			"actions": [
				{
					"character": "House",
					"action_type": "move",
					"duration": 5,
					"position": {
						"startX": 531.3,
						"startY": 709.3,
						"endX": 774.9,
						"endY": 707.3,
						"scale": 0.6
					}
				}
			]
		},
		{
			"timestamp": 130,
			"actions": [
				{
					"action_type": "scene",
					"scene": "Office",
					"transition_effect": "fade_out",
					"duration": 2
				}
			]
		},
		{
			"timestamp": 135,
			"actions": [
				{
					"action_type": "scene",
					"scene": "Office",
					"transition_effect": "fade_in",
					"duration": 2,
					"initialState": {
						"characters": [
							{
								"name": "House",
								"visible": true,
								"position": {
									"startX": 847.9,
									"startY": 644.3,
									"scale": 0.6
								}
							}
						]
					}
				}
			]
		},
		{
			"timestamp": 140,
			"actions": [
				{
					"character": "House",
					"action_type": "talk",
					"dialogue": "Let's review the evidence... Eureka! It must be autoimmune encephalitis!",
					"duration": 5
				}
			]
		},
		{
			"timestamp": 150,
			"actions": [
				{
					"character": "House",
					"action_type": "talk",
					"dialogue": "Start immunosuppressants and plasma exchange.",
					"duration": 4
				}
			]
		},
		{
			"timestamp": 160,
			"actions": [
				{
					"character": "House",
					"action_type": "move",
					"duration": 4,
					"position": {
						"startX": 847.9,
						"startY": 644.3,
						"endX": 699.5,
						"endY": 514.7,
						"scale": 0.6
					}
				}
			]
		},
		{
			"timestamp": 170,
			"actions": [
				{
					"character": "House",
					"action_type": "disappear",
					"duration": 2
				}
			]
		}
	]
}
